{
  "catalog_id": "ai-agent-skills-100",
  "title": "Katalog von hundert KI-Skills für KI-Skills und KI-Agents",
  "language": "de",
  "count": 100,
  "families": [
    {
      "id": "A",
      "name": "Intake & Dokumentenverarbeitung"
    },
    {
      "id": "B",
      "name": "Verständnis & Klassifikation"
    },
    {
      "id": "C",
      "name": "Matching & Routing"
    },
    {
      "id": "D",
      "name": "Prognose & Prognostik"
    },
    {
      "id": "E",
      "name": "Optimierung & Orchestrierung"
    },
    {
      "id": "F",
      "name": "Abrechnung, Settlement & Metering"
    },
    {
      "id": "G",
      "name": "Compliance, Audit & Reporting"
    },
    {
      "id": "H",
      "name": "Human-in-the-loop & Quality Control"
    },
    {
      "id": "I",
      "name": "Agentic Orchestration & Tool-Use"
    },
    {
      "id": "J",
      "name": "Domain-specific Skills"
    }
  ],
  "skills": [
    {
      "id": 1,
      "family": "A",
      "name": "Multimodal Intake Gateway",
      "description": "Einheitlicher Eingang für Text, PDF, Bild, Formular, Chat und Voice; erzeugt aus rohem Input einen normierten Case.",
      "inputs": [
        "Dateien",
        "Nachrichten",
        "Audio",
        "Metadaten"
      ],
      "outputs": [
        "case_id",
        "Kanal",
        "Rohartefakte",
        "Vor-Metadaten"
      ],
      "inputs_outputs": "In: Dateien, Nachrichten, Audio, Metadaten. Out: case_id, Kanal, Rohartefakte, Vor-Metadaten.",
      "technologies": [
        "LLM",
        "VLM",
        "OCR",
        "ASR"
      ],
      "model_types": [
        "Healthcare Intake",
        "Claims",
        "Public Services"
      ],
      "business_model_ids": [],
      "implementation_note": ""
    },
    {
      "id": 2,
      "family": "A",
      "name": "OCR- und Layout-Parser",
      "description": "Extrahiert Text, Tabellen, Felder und Seitenlogik aus PDFs/Scans.",
      "inputs": [
        "PDF/Bild"
      ],
      "outputs": [
        "Textblöcke",
        "Bounding Boxes",
        "Tabellen-JSON"
      ],
      "inputs_outputs": "In: PDF/Bild. Out: Textblöcke, Bounding Boxes, Tabellen-JSON.",
      "technologies": [
        "OCR",
        "LayoutLM/VLM"
      ],
      "model_types": [
        "Abrechnung",
        "Factoring",
        "Claims",
        "Procurement"
      ],
      "business_model_ids": [],
      "implementation_note": ""
    },
    {
      "id": 3,
      "family": "A",
      "name": "E-Mail- und Anhangs-Triage",
      "description": "Erfasst eingehende Mails, trennt Fälle, Anhänge und Folgeaktionen.",
      "inputs": [
        "RFC822-Mail",
        "Anhänge"
      ],
      "outputs": [
        "Fallzuordnung",
        "Doktypen",
        "Priorität"
      ],
      "inputs_outputs": "In: RFC822-Mail, Anhänge. Out: Fallzuordnung, Doktypen, Priorität.",
      "technologies": [
        "LLM",
        "OCR",
        "Klassifikation"
      ],
      "model_types": [
        "Inkasso",
        "Facility",
        "Vergabe",
        "Travel"
      ],
      "business_model_ids": [],
      "implementation_note": ""
    },
    {
      "id": 4,
      "family": "A",
      "name": "Formular-Autofill-Extractor",
      "description": "Liest Pflichtfelder und füllt strukturierte Antrags-/Einreichungsmodelle vor.",
      "inputs": [
        "Formulare",
        "PDFs",
        "Nutzerangaben"
      ],
      "outputs": [
        "validiertes Formular-JSON"
      ],
      "inputs_outputs": "In: Formulare, PDFs, Nutzerangaben. Out: validiertes Formular-JSON.",
      "technologies": [
        "LLM",
        "Regeln",
        "OCR"
      ],
      "model_types": [
        "Genehmigung",
        "Benefits",
        "Kommune",
        "Migration"
      ],
      "business_model_ids": [],
      "implementation_note": ""
    },
    {
      "id": 5,
      "family": "A",
      "name": "Voice-to-Case Intake",
      "description": "Wandelt freies Telefon-/Sprachaufkommen in strukturierte Fälle um.",
      "inputs": [
        "Audio/VoIP",
        "Sprecherkanal"
      ],
      "outputs": [
        "Transkript",
        "Zusammenfassung",
        "Fallobjekt"
      ],
      "inputs_outputs": "In: Audio/VoIP, Sprecherkanal. Out: Transkript, Zusammenfassung, Fallobjekt.",
      "technologies": [
        "ASR",
        "Speaker diarization",
        "LLM"
      ],
      "model_types": [
        "Teletriage",
        "Dolmetschen",
        "Callcenter",
        "Kommune"
      ],
      "business_model_ids": [],
      "implementation_note": ""
    },
    {
      "id": 6,
      "family": "A",
      "name": "Bild-Intake-Validator",
      "description": "Prüft, ob Bilder für Schadens-, Mangel- oder Inspektionsfälle brauchbar sind.",
      "inputs": [
        "Fotos/Videos"
      ],
      "outputs": [
        "Qualitätsurteil",
        "Nachforderungs-Prompts",
        "Referenzbilder"
      ],
      "inputs_outputs": "In: Fotos/Videos. Out: Qualitätsurteil, Nachforderungs-Prompts, Referenzbilder.",
      "technologies": [
        "Vision",
        "VLM"
      ],
      "model_types": [
        "Schaden",
        "Renovierung",
        "Abfall",
        "Recommerce"
      ],
      "business_model_ids": [],
      "implementation_note": ""
    },
    {
      "id": 7,
      "family": "A",
      "name": "Dokument-Deduplikation und Versionsauflösung",
      "description": "Erkennt Dubletten, neue Versionen und zusammengehörige Dokumentketten.",
      "inputs": [
        "Dokumente",
        "Hashes",
        "Metadaten"
      ],
      "outputs": [
        "Version Graph",
        "Master-Dokument"
      ],
      "inputs_outputs": "In: Dokumente, Hashes, Metadaten. Out: Version Graph, Master-Dokument.",
      "technologies": [
        "Embeddings",
        "Graph",
        "Regeln"
      ],
      "model_types": [
        "Abrechnung",
        "Entlassung",
        "Due Diligence",
        "Grants"
      ],
      "business_model_ids": [],
      "implementation_note": ""
    },
    {
      "id": 8,
      "family": "A",
      "name": "PII/PHI-Redaction Skill",
      "description": "Erkennt und maskiert personenbezogene/sensible Daten vor Weitergabe.",
      "inputs": [
        "Text",
        "PDF",
        "Audio-Transkript"
      ],
      "outputs": [
        "redigierte Fassung",
        "Redaktionsprotokoll"
      ],
      "inputs_outputs": "In: Text, PDF, Audio-Transkript. Out: redigierte Fassung, Redaktionsprotokoll.",
      "technologies": [
        "NER",
        "LLM",
        "Regeln"
      ],
      "model_types": [
        "Health",
        "Legal",
        "Benefits",
        "Cyber"
      ],
      "business_model_ids": [],
      "implementation_note": ""
    },
    {
      "id": 9,
      "family": "A",
      "name": "Schema-Mapping Skill",
      "description": "Überführt Freitext/Felder in Zielschemata wie Claims, Orders, FHIR, XRechnung.",
      "inputs": [
        "Extrakte",
        "Freitext"
      ],
      "outputs": [
        "normalisierte JSON-Objekte"
      ],
      "inputs_outputs": "In: Extrakte, Freitext. Out: normalisierte JSON-Objekte.",
      "technologies": [
        "LLM",
        "Regeln",
        "Ontologien"
      ],
      "model_types": [
        "Billing",
        "Carbon",
        "Vergabe",
        "Research"
      ],
      "business_model_ids": [],
      "implementation_note": ""
    },
    {
      "id": 10,
      "family": "A",
      "name": "Consent- und Provenance-Binder",
      "description": "Verknüpft Fall, Einwilligung/Rechtsgrundlage, Quelle und Datenherkunft.",
      "inputs": [
        "Case",
        "User action",
        "Metadaten"
      ],
      "outputs": [
        "Provenance-Record",
        "Consent-Status"
      ],
      "inputs_outputs": "In: Case, User action, Metadaten. Out: Provenance-Record, Consent-Status.",
      "technologies": [
        "Regeln",
        "Graph"
      ],
      "model_types": [
        "Homecare",
        "Sprachmittlung",
        "Benefits",
        "Health Data"
      ],
      "business_model_ids": [],
      "implementation_note": ""
    },
    {
      "id": 11,
      "family": "B",
      "name": "Intent- und Task-Classifier",
      "description": "Erkennt, welches Problem vorliegt und welcher Skill- oder Prozesspfad gestartet werden muss.",
      "inputs": [
        "Text/Voice summary"
      ],
      "outputs": [
        "Intention",
        "Task-Type",
        "Confidence"
      ],
      "inputs_outputs": "In: Text/Voice summary. Out: Intention, Task-Type, Confidence.",
      "technologies": [
        "LLM",
        "Klassifikation"
      ],
      "model_types": [
        "Intake",
        "Service",
        "Benefits",
        "Contact Center"
      ],
      "business_model_ids": [
        1,
        2,
        67,
        83,
        84
      ],
      "implementation_note": "Temperature niedrig; Closed Taxonomy + OOD-Erkennung statt Freitextlabels."
    },
    {
      "id": 12,
      "family": "B",
      "name": "Dokumenttyp-Klassifikator",
      "description": "Bestimmt zuverlässig Art und Zweck eines Dokuments.",
      "inputs": [
        "PDF/Bild/Text"
      ],
      "outputs": [
        "Typ",
        "Untertyp",
        "Routing-Hinweis"
      ],
      "inputs_outputs": "In: PDF/Bild/Text. Out: Typ, Untertyp, Routing-Hinweis.",
      "technologies": [
        "OCR",
        "VLM",
        "LLM"
      ],
      "model_types": [
        "Abrechnung",
        "Factoring",
        "Genehmigung",
        "Vergabe"
      ],
      "business_model_ids": [
        3,
        16,
        34,
        56,
        83
      ],
      "implementation_note": "Typkatalog versionieren; Unknown-Klasse obligatorisch."
    },
    {
      "id": 13,
      "family": "B",
      "name": "Entity- und Feld-Extractor",
      "description": "Zieht strukturierte Entitäten wie Beträge, Daten, Parteien, Codes, Orte.",
      "inputs": [
        "Text/Dokumente"
      ],
      "outputs": [
        "Entitäten mit Positionen und Confidence"